### ISSUE TITLE
Connecting to server in remote networks

### ISSUE THREAD

**Issue by Paul-A-Jones** [aler9/rtsp-simple-server#241]
## Which version are you using?

v0.14.2

## Question

Hi all,

I'm having problems with the server not responding for around 5 seconds when it receives a connection from a client which is located in a remote network. An example of the exchange can be found below. There doesn't seem to be any obvious necessity for this and if the server is located on the same host as the client, the server responds almost immediately. 

In this particular exchange the client connection timeout was set to 5 seconds, hence it's drastic response. The server sends no data until frame 8, over five seconds after the connection was opened.
```
No.	Time	Source	Destination	Protocol	Length	Info
1	0.000000	172.16.4.20	10.10.6.126	TCP	66	19483 → 8554 [SYN] Seq=0 Win=64800 Len=0 MSS=1350 WS=256 SACK_PERM=1
2	0.140239	10.10.6.126	172.16.4.20	TCP	66	8554 → 19483 [SYN, ACK] Seq=0 Ack=1 Win=65535 Len=0 MSS=1250 WS=256 SACK_PERM=1
3	0.140301	172.16.4.20	10.10.6.126	TCP	54	19483 → 8554 [ACK] Seq=1 Ack=1 Win=131072 Len=0
4	0.150481	172.16.4.20	10.10.6.126	RTSP	139	OPTIONS rtsp://10.10.6.126:8554/live RTSP/1.0
5	0.314958	10.10.6.126	172.16.4.20	TCP	54	8554 → 19483 [ACK] Seq=1 Ack=86 Win=262400 Len=0
6	5.276644	172.16.4.20	10.10.6.126	TCP	54	19483 → 8554 [FIN, ACK] Seq=86 Ack=1 Win=131072 Len=0
7	5.383033	10.10.6.126	172.16.4.20	TCP	54	8554 → 19483 [ACK] Seq=1 Ack=87 Win=262400 Len=0
8	5.383765	10.10.6.126	172.16.4.20	RTSP	182	Reply: RTSP/1.0 200 OK
9	5.383799	172.16.4.20	10.10.6.126	TCP	54	19483 → 8554 [RST, ACK] Seq=87 Ack=129 Win=0 Len=0
10	5.383837	10.10.6.126	172.16.4.20	TCP	54	8554 → 19483 [FIN, ACK] Seq=129 Ack=87 Win=262400 Len=0
```

Are there any config setting for rtsp_simple_server which can minimise this delay? Or are there potential sources of this through the network configuration?

TIA,
Paul

**Comment by Paul-A-Jones** [comment]
All's good. Turns out BitDefender was being suspicious of RTSP running over TCP/8554, and decided to delegate the decision to some cloud-based entity.

**Comment by aler9** [comment]
:)
