### ISSUE TITLE
Unexpected Path Disconnect

### ISSUE THREAD

**Issue by Vrazzer** [aler9/rtsp-simple-server#649]
## Which version are you using?

v0.17.3 w/rtqtime= patch

## Which operating system are you using?

OS

- [x] Linux
- [ ] Windows
- [ ] macOS

Architecture

- [ ] amd64
- [ ] arm64
- [x] arm7
- [ ] arm6

## Describe the issue

There appears to be some outgoing stream network condition that can cause the incoming stream to become unavailable to clients. 

I use rtsp-simple-server to stream Raspberry-PI based network cameras as part of my security system. After patching around the previously reported rpttime= issue, they have been running nonstop until last night. The pair of cameras had run 261 and 219 hours respectively. The PIs have the same uptime (were last restated by power-failure), but only 26 days which is not a magic value I am aware of. At just after midnight local, the followed occurred (sorry for the differing timezones, but event time is identical):

From camera #1 (CDT time):
```
2021/10/14 00:40:08 I [0/0] [path stream] destroyed
2021/10/14 04:13:10 I [0/0] [RTSP] [session 745515111] closed
2021/10/14 04:13:10 I [0/0] [RTSP] [session 630199157] closed
2021/10/14 04:13:10 I [0/0] [RTSP] [conn 192.168.0.147:52420] ERR: session not found
2021/10/14 04:13:10 I [0/0] [RTSP] [conn 192.168.0.147:52420] closed
2021/10/14 04:13:10 I [0/0] [RTSP] [conn 192.168.0.147:58084] opened
2021/10/14 04:13:10 I [0/0] [RTSP] [conn 192.168.0.147:58264] opened
2021/10/14 04:13:10 I [0/0] [RTSP] [conn 192.168.0.147:58148] opened
2021/10/14 04:13:10 I [0/0] [RTSP] [conn 192.168.0.147:58204] opened
2021/10/14 04:13:10 I [0/0] [RTSP] [conn 192.168.0.147:58026] opened
2021/10/14 04:13:10 I [0/0] [RTSP] [conn 192.168.0.147:58384] opened
2021/10/14 04:13:10 I [0/0] [RTSP] [conn 192.168.0.147:58320] opened
2021/10/14 04:13:10 I [0/0] [path stream] created
2021/10/14 04:13:10 I [0/0] [RTSP] [conn 192.168.0.147:58506] opened
2021/10/14 04:13:10 I [0/0] [RTSP] [conn 192.168.0.147:58148] ERR: no one is publishing to path 'stream'
2021/10/14 04:13:10 I [0/0] [RTSP] [conn 192.168.0.147:58148] closed
```
From camera #2 (BST time):
```
2021/10/14 10:13:10 I [0/0] [path stream] destroyed
2021/10/14 10:13:10 I [0/0] [RTSP] [conn 192.168.0.147:35156] ERR: session not found
2021/10/14 10:13:10 I [0/0] [RTSP] [conn 192.168.0.147:50928] opened
2021/10/14 10:13:10 I [0/0] [RTSP] [conn 192.168.0.147:35156] closed
2021/10/14 10:13:10 I [0/0] [RTSP] [conn 192.168.0.147:50636] opened
2021/10/14 10:13:10 I [0/0] [RTSP] [conn 192.168.0.147:50572] opened
2021/10/14 10:13:10 I [0/0] [RTSP] [conn 192.168.0.147:51054] opened
2021/10/14 10:13:10 I [0/0] [RTSP] [conn 192.168.0.147:51308] opened
2021/10/14 10:13:10 I [0/0] [RTSP] [conn 192.168.0.147:50994] opened
2021/10/14 10:13:10 I [0/0] [RTSP] [conn 192.168.0.147:51430] opened
2021/10/14 10:13:10 I [0/0] [RTSP] [conn 192.168.0.147:50692] opened
2021/10/14 10:13:10 I [0/0] [RTSP] [conn 192.168.0.147:51366] opened
2021/10/14 10:13:10 I [0/0] [RTSP] [conn 192.168.0.147:51548] opened
2021/10/14 10:13:10 I [0/0] [RTSP] [conn 192.168.0.147:50808] opened
2021/10/14 10:13:10 I [0/0] [RTSP] [conn 192.168.0.147:50514] opened
2021/10/14 10:13:10 I [0/0] [RTSP] [conn 192.168.0.147:50872] opened
2021/10/14 10:13:10 I [0/0] [RTSP] [conn 192.168.0.147:50756] opened
2021/10/14 10:13:10 I [0/0] [RTSP] [conn 192.168.0.147:51126] opened
2021/10/14 10:13:10 I [0/0] [RTSP] [conn 192.168.0.147:51188] opened
2021/10/14 10:13:10 I [0/0] [path stream] created
2021/10/14 10:13:10 I [0/0] [RTSP] [conn 192.168.0.147:51244] opened
2021/10/14 10:13:10 I [0/0] [RTSP] [conn 192.168.0.147:51910] opened
2021/10/14 10:13:10 I [0/0] [RTSP] [conn 192.168.0.147:52030] opened
2021/10/14 10:13:10 I [0/0] [RTSP] [conn 192.168.0.147:51974] opened
2021/10/14 10:13:10 I [0/0] [RTSP] [conn 192.168.0.147:51482] opened
2021/10/14 10:13:10 I [0/0] [RTSP] [conn 192.168.0.147:52152] opened
2021/10/14 10:13:10 I [0/0] [RTSP] [conn 192.168.0.147:50636] ERR: no one is publishing to path 'stream'
```
Post event, there is an endless sequence of "ERR: no one is publishing to path 'stream'" as the ffmpeg consumer attempts to reconnect and fails. 

Note that the source ffmpeg instances are passing their data to rtsp-simple-server via localhost. Thus, there is no way that an external network event could impact them. I cannot find any other details on the network event itself. Have many servers and services, but not found any other symptoms. Both the PIs are on the same switch (along with two commercial network cameras) and maybe it glitched. Regardless, any external network events should not impact localhost source streaming.

To restore service, I had to restart the ffmpeg source (though did not restart rtsp-simple-server). That resulted in the expected new source stream:

```
2021/10/14 10:16:48 I [0/0] [RTSP] [conn 127.0.0.1:35402] opened
2021/10/14 10:16:48 I [0/0] [RTSP] [session 117591740] opened by 127.0.0.1:35402
2021/10/14 10:16:48 I [1/0] [RTSP] [session 117591740] is publishing to path 'stream', 1 track with UDP
2021/10/14 10:17:50 I [1/0] [RTSP] [conn 192.168.0.147:57080] openeded
2021/10/14 10:17:50 I [1/0] [RTSP] [session 249305061] opened by 192.168.0.147:57080
2021/10/14 10:17:50 I [1/1] [RTSP] [session 249305061] is reading from path 'stream', 1 track with UDP
```

I left one of the cameras in the failed state for additional analysis. It continues with its endless loop where the consumer keeps reconnecting and requesting the stream:
```
2021/10/14 10:41:06 I [0/0] [RTSP] [conn 192.168.0.147:43524] opened
2021/10/14 10:41:06 I [0/0] [RTSP] [conn 192.168.0.147:43524] ERR: no one is publishing to path 'stream'
2021/10/14 10:41:06 I [0/0] [RTSP] [conn 192.168.0.147:43524] closed
```
Using tcpdump on that server, I can see the local ffmpeg source is still passing data to rtsp-simple-server:
```
oot@raspberrypi:/home/pi# tcpdump -s 0 -vvni lo tcp port 8554
tcpdump: listening on lo, link-type EN10MB (Ethernet), capture size 262144 bytes
10:45:38.939745 IP (tos 0x0, ttl 64, id 8867, offset 0, flags [DF], proto TCP (6), length 52)
    127.0.0.1.8554 > 127.0.0.1.46258: Flags [.], cksum 0xfe28 (incorrect -> 0x49d4), seq 3089780564, ack 4094962518, win 512, options [nop,nop,TS val 2337254048 ecr 2337238688], length 0
10:45:38.939790 IP (tos 0x0, ttl 64, id 64073, offset 0, flags [DF], proto TCP (6), length 52)
    127.0.0.1.46258 > 127.0.0.1.8554: Flags [.], cksum 0xfe28 (incorrect -> 0x9119), seq 1, ack 1, win 512, options [nop,nop,TS val 2337254048 ecr 1356947912], length 0
10:45:54.299755 IP (tos 0x0, ttl 64, id 8868, offset 0, flags [DF], proto TCP (6), length 52)
    127.0.0.1.8554 > 127.0.0.1.46258: Flags [.], cksum 0xfe28 (incorrect -> 0xd1d3), seq 0, ack 1, win 512, options [nop,nop,TS val 2337269408 ecr 2337254048], length 0
10:45:54.299814 IP (tos 0x0, ttl 64, id 64074, offset 0, flags [DF], proto TCP (6), length 52)
    127.0.0.1.46258 > 127.0.0.1.8554: Flags [.], cksum 0xfe28 (incorrect -> 0x5519), seq 1, ack 1, win 512, options [nop,nop,TS val 2337269408 ecr 1356947912], length 0
10:46:09.659749 IP (tos 0x0, ttl 64, id 8869, offset 0, flags [DF], proto TCP (6), length 52)
    127.0.0.1.8554 > 127.0.0.1.46258: Flags [.], cksum 0xfe28 (incorrect -> 0x59d3), seq 0, ack 1, win 512, options [nop,nop,TS val 2337284768 ecr 2337269408], length 0

root@raspberrypi:/home/pi# tcpdump -ni lo udp port 8000
tcpdump: verbose output suppressed, use -v or -vv for full protocol decode
listening on lo, link-type EN10MB (Ethernet), capture size 262144 bytes
10:48:32.153004 IP 127.0.0.1.23160 > 127.0.0.1.8000: UDP, length 1472
10:48:32.153110 IP 127.0.0.1.23160 > 127.0.0.1.8000: UDP, length 1472
10:48:32.153202 IP 127.0.0.1.23160 > 127.0.0.1.8000: UDP, length 1472
10:48:32.153293 IP 127.0.0.1.23160 > 127.0.0.1.8000: UDP, length 1472
10:48:32.153508 IP 127.0.0.1.23160 > 127.0.0.1.8000: UDP, length 1472

root@raspberrypi:/home/pi# tcpdump -ni lo udp port 8001
tcpdump: verbose output suppressed, use -v or -vv for full protocol decode
listening on lo, link-type EN10MB (Ethernet), capture size 262144 bytes
10:50:36.486661 IP 127.0.0.1.23161 > 127.0.0.1.8001: UDP, length 28
10:50:41.491488 IP 127.0.0.1.23161 > 127.0.0.1.8001: UDP, length 28
10:50:46.615083 IP 127.0.0.1.23161 > 127.0.0.1.8001: UDP, length 28
10:50:51.745420 IP 127.0.0.1.23161 > 127.0.0.1.8001: UDP, length 28
10:50:56.863153 IP 127.0.0.1.23161 > 127.0.0.1.8001: UDP, length 28
```
Since the ffmpeg source is still connected to rtsp-simple-server, it cannot determine there is a problem and thus runs happily (and any monitoring fails to trigger). Have seen another bug report mentioning that after a disconnect, the stream path does not work correctly. Am guessing there are two bugs interacting to make this a nasty situation. 

I can leave the one camera in its connected but broken state for the rest of the day if any specific diagnostics would be helpful.

**Comment by brothercorvo** [comment]
I have a similar issue. We are trying to integrate with rtsp-simple-server with FreeTAKServer. I'm using TAK ICU to connect to rtsp-simple-server and stream.
The connection is opened, keeps open for 5-10 seconds and then closes.
changing the time out has not produced any change.


when I query the API  using /v1/paths/list I get a stream like the one below, this is created dynamically. In my app I cannot configure most of them,
However I can now created a path with the API and I wonder if that is supposed to help configuring the options?

```
{
    "items": {
        "live/corvovideo": {
            "confName": "~^.*$",
            "conf": {
                "source": "publisher",
                "sourceProtocol": "automatic",
                "sourceAnyPortEnable": false,
                "sourceFingerprint": "",
                "sourceOnDemand": false,
                "sourceOnDemandStartTimeout": "10s",
                "sourceOnDemandCloseAfter": "10s",
                "sourceRedirect": "",
                "disablePublisherOverride": false,
                "fallback": "",
                "publishUser": "",
                "publishPass": "",
                "publishIPs": [],
                "readUser": "",
                "readPass": "",
                "readIPs": [],
                "runOnInit": "",
                "runOnInitRestart": false,
                "runOnDemand": "",
                "runOnDemandRestart": false,
                "runOnDemandStartTimeout": "10s",
                "runOnDemandCloseAfter": "10s",
                "runOnPublish": "",
                "runOnPublishRestart": false,
                "runOnRead": "",
                "runOnReadRestart": false
            },
            "source": {
                "type": "rtspSession",
                "id": "687453819"
            },
            "sourceReady": true,
            "readers": []
        }
    }

}

}
```

**Comment by Vrazzer** [comment]
The issue occurred again with the additional logging below. Seems rtsp-simple-server believes it is no longer receiving packets from the source ffmpeg (via the loopback interface) on two unrelated RPis (though tcpdump shows it is). The common failure times make no sense-- only common points are uptime (both restarted on a prior power failure) and same rtsp master consumer process (but with individual ffmpeg instances). May try restarting one of the RPis to see if that changes the failure timing and narrows the cause. 

(As to the poster above with the 10-15 second disconnect, that sounds like a different issue. Sounds like the stream never gets established vs this case where it runs fine on multiple servers for a several days and then has a synchronized failure.)

```
2021/11/02 00:46:49 INF [0/0] [RTSP] [session 681912303] closed (no UDP packets received in a while)
2021/11/02 08:43:34 INF [0/0] [RTSP] [session 386499575] closed (terminated)
2021/11/02 08:43:34 INF [0/0] [path stream] destroyed
2021/11/02 08:43:34 DEB [0/0] [RTSP] [conn 192.168.0.147:59284] [c->s] TEARDOWN rtsp://192.168.1.22:8554/stream/ RTSP/1.0
CSeq: 9451
Session: 2474739116
User-Agent: Lavf58.29.100

```

**Comment by Vrazzer** [comment]
Just a quick follow up on this issue-- while I have yet to identify the cause of the occasional timeout that triggers the rtsp-simple-server disconnect, it looks like the problem is compounded by how rtsp-simple-server launches the stream publisher (ffmpeg in my case).

After ffmpeg shuts down (either because rtsp-simple-server killed it or it detects rtsp-simple-server closing the TCP RTSP socket), the runOnDemand restart often fails and begins an infinite failure loop. I am using ffmpeg + RPi local camera and the shutdown can be slow. It appears rtsp-simple-server can launch another copy of ffmpeg before the existing one has fully terminated which causes contention for the camera leaving it in a bad state. That makes all subsequent ffmpeg launches fail and hence the infinite loop as rtsp-simple-server keeps restarting it. 

Might it be possible to add a configurable "run on init restart timer"?

**Comment by Vrazzer** [comment]
Scratch that-- the camera contention is being caused by the RPi camera driver faulting in kernel space. After that, ffmpeg fails at startup and the endless loop occurs. No amount of waiting seems to resolve it. Forcing a reboot seems extreme, but might have to try it.

**Comment by aler9** [comment]
>  the camera contention is being caused by the RPi camera driver faulting in kernel space.

In the future i'd like to implement native support for the Raspberry camera into the server, in order to solve these issues or at least report them to the users whey they occur, but for the moment you have to rely on existing tools. My tool of choice for accessing the RPI camera video is not ffmpeg, but rpicamsrc, as described in the README.
